{
  "metadata": {
    "survey": {
      "boundary": "Public contracts guide and CLI reference only; no live help execution, implementation, tests, or external links.",
      "counts": {
        "candidates": 12,
        "defenses": 0,
        "promises": 12,
        "questions": 0
      },
      "coverage": "not_established",
      "format": "survey-register-proposal/v1",
      "inventory": [
        {
          "path": "docs/CLI.md",
          "sha256": "ab29316a26f495da7d867594705be213e97ef9ea4d0190fb090329086f0ac5ab",
          "source_id": "40aa42c6992ee72d77f8f4575f631e5cbeb83146842914e927714796c0de2690",
          "status": "ready"
        },
        {
          "path": "docs/CONTRACTS.md",
          "sha256": "270ba4f568a4a323cd090b23b43b93a99f7f5945c4631c4fc19897d20b599725",
          "source_id": "b9a57124a1c8e5256123b3a882aee8f32f7af0b19d85c8f7002a12466bab25f0",
          "status": "ready"
        },
        {
          "path": "docs/CONFIG_REFERENCE.md",
          "reason": "General configuration reference outside this bounded first pass",
          "status": "excluded"
        }
      ],
      "limitations": [
        "Quotation checks do not establish faithful meaning or complete coverage.",
        "Defenses, falsifying checks, and reachability have not been assessed.",
        "Proposal IDs identify exact candidate content within the declared repository; edits can change them.",
        "This proposal does not reconcile earlier registers or change human decisions, evidence, or bindings."
      ],
      "questions": [],
      "rejected_attempts": 0,
      "review_state": "unaccepted",
      "source_notice": "Historical heldtospec source snapshot. Original quotations contain an obsolete project name and command spellings. Use heldtospec in current prose; quoted commands are not verified current instructions.",
      "submissions": [
        {
          "assessments": [
            {
              "coverage": "whole_document",
              "note": "Read full document and selected contracts-related candidates. This demonstration is not an exhaustive claim inventory or independent evaluation.",
              "source_id": "40aa42c6992ee72d77f8f4575f631e5cbeb83146842914e927714796c0de2690",
              "uninspected": "No source portions were reported unread in the original review; candidate discovery was selective, not exhaustive."
            },
            {
              "coverage": "whole_document",
              "note": "Read full document and selected contracts-related candidates. This demonstration is not an exhaustive claim inventory or independent evaluation.",
              "source_id": "b9a57124a1c8e5256123b3a882aee8f32f7af0b19d85c8f7002a12466bab25f0",
              "uninspected": "No source portions were reported unread in the original review; candidate discovery was selective, not exhaustive."
            }
          ],
          "id": "6da725dcf8ce009c58f68d15be28a5bf46b140773ee039c0aa96f95847347656",
          "response_sha256": "755c39c4aeb358c09fb61916a702f6438192e766fdf9a694f4a8ff290e55f952",
          "reviewer": "Replay of prior external assistant judgments; no fresh or independent review"
        }
      ]
    }
  },
  "producer": {
    "inputs": [
      "docs/CLI.md",
      "docs/CONTRACTS.md"
    ],
    "metadata": {
      "collector_sha256": "4b8c5e3d6994930ec439c09619700bb90ad17d7c40681d6ae1bc9e68480f0304",
      "exporter_sha256": "ab0d81af15ae9d0ab59171edba6aa1902bf8598de93121a85b44677099ccbd51",
      "packet_id": "6cc816b654c8b8e1a1ed8a646c8816cac53a8b8f4da98d706f91509a16e332b9",
      "source_identity": "Repository and revision are submitter declarations; source byte hashes were checked."
    },
    "name": "upheld-survey-register",
    "source_repo": "https://github.com/yzm1/heldtospec",
    "source_rev": "9ccd2766580e83b21f5d7717c7cee222f8fc6c2d"
  },
  "promises": [
    {
      "confidence": "suspected",
      "defenses": [],
      "detail": "\nThe generated schema is a starting point; review nullability, uniqueness,",
      "evidence_tier": "read",
      "id": "SRV-3c883070e9ef718a52426536c65b633d62080999474b6e239b43837cce7c7352",
      "metadata": {
        "survey": {
          "candidate": {
            "claim": "Generated contracts require review before publication.",
            "faithfulness_review": "Compared the proposed claim with the quoted passage and full document. Schema inference supplies a starting point; review includes constraints, ownership, and service levels.",
            "kind": "obligation",
            "next_question": "Which fields can inference establish and which need an owner decision?",
            "qualifiers": "Schema inference supplies a starting point; review includes constraints, ownership, and service levels.",
            "rationale": "Publishing inferred settings without review could adopt unintended promises.",
            "references": [
              {
                "end_line": 17,
                "quote": "\nThe generated schema is a starting point; review nullability, uniqueness,",
                "source_id": "b9a57124a1c8e5256123b3a882aee8f32f7af0b19d85c8f7002a12466bab25f0",
                "start_line": 16
              }
            ],
            "subject": "heldtospec public contracts interface at the pinned revision",
            "uncertainty": "Source reading only; intended meaning and executable behavior still need independent review."
          },
          "candidate_id": "067a090c2cf503a32fbe36cb6e0f20c1e68e3823e7b7632d47e43f79e947b0c1",
          "defense_assessment": "not_performed",
          "references": [
            {
              "end_line": 17,
              "path": "docs/CONTRACTS.md",
              "quote": "\nThe generated schema is a starting point; review nullability, uniqueness,",
              "sha256": "270ba4f568a4a323cd090b23b43b93a99f7f5945c4631c4fc19897d20b599725",
              "source_id": "b9a57124a1c8e5256123b3a882aee8f32f7af0b19d85c8f7002a12466bab25f0",
              "start_line": 16
            }
          ],
          "review_state": "unaccepted",
          "submission_ids": [
            "6da725dcf8ce009c58f68d15be28a5bf46b140773ee039c0aa96f95847347656"
          ]
        }
      },
      "next_step": "Which fields can inference establish and which need an owner decision?",
      "published_in": [
        "docs/CONTRACTS.md#L16-L17"
      ],
      "reachability": "unknown",
      "source": "docs/CONTRACTS.md#L16-L17",
      "subject_scope": "heldtospec public contracts interface at the pinned revision",
      "text": "Generated contracts require review before publication.\nScope and limits: Schema inference supplies a starting point; review includes constraints, ownership, and service levels.",
      "the_test_that_would_catch_it": "Unknown; this source survey did not establish a falsifying check.",
      "why": "Publishing inferred settings without review could adopt unintended promises."
    },
    {
      "confidence": "suspected",
      "defenses": [],
      "detail": "| `checks[].expr` | The expression must be true for every row. |",
      "evidence_tier": "read",
      "id": "SRV-66a0a2b9c1bcc91d2561d4ea7e988b5575666f39a05d3945d7907420d16d6d7c",
      "metadata": {
        "survey": {
          "candidate": {
            "claim": "A contract expression must hold for every row.",
            "faithfulness_review": "Compared the proposed claim with the quoted passage and full document. Applies to checks[].expr; null semantics are not specified here.",
            "kind": "behavior",
            "next_question": "How are null expression results and empty inputs handled?",
            "qualifiers": "Applies to checks[].expr; null semantics are not specified here.",
            "rationale": "Some or all row failures may otherwise escape enforcement.",
            "references": [
              {
                "end_line": 89,
                "quote": "| `checks[].expr` | The expression must be true for every row. |",
                "source_id": "b9a57124a1c8e5256123b3a882aee8f32f7af0b19d85c8f7002a12466bab25f0",
                "start_line": 89
              }
            ],
            "subject": "heldtospec public contracts interface at the pinned revision",
            "uncertainty": "Source reading only; intended meaning and executable behavior still need independent review."
          },
          "candidate_id": "301d9a4ffb6a7ad7ee6b83070b338a98d89183329dd9f45384cd4d644e608a6b",
          "defense_assessment": "not_performed",
          "references": [
            {
              "end_line": 89,
              "path": "docs/CONTRACTS.md",
              "quote": "| `checks[].expr` | The expression must be true for every row. |",
              "sha256": "270ba4f568a4a323cd090b23b43b93a99f7f5945c4631c4fc19897d20b599725",
              "source_id": "b9a57124a1c8e5256123b3a882aee8f32f7af0b19d85c8f7002a12466bab25f0",
              "start_line": 89
            }
          ],
          "review_state": "unaccepted",
          "submission_ids": [
            "6da725dcf8ce009c58f68d15be28a5bf46b140773ee039c0aa96f95847347656"
          ]
        }
      },
      "next_step": "How are null expression results and empty inputs handled?",
      "published_in": [
        "docs/CONTRACTS.md#L89-L89"
      ],
      "reachability": "unknown",
      "source": "docs/CONTRACTS.md#L89-L89",
      "subject_scope": "heldtospec public contracts interface at the pinned revision",
      "text": "A contract expression must hold for every row.\nScope and limits: Applies to checks[].expr; null semantics are not specified here.",
      "the_test_that_would_catch_it": "Unknown; this source survey did not establish a falsifying check.",
      "why": "Some or all row failures may otherwise escape enforcement."
    },
    {
      "confidence": "suspected",
      "defenses": [],